deal_id,announced_date,deal_type,status,target_or_issuer,acquirer_or_investor,sector,geography,transaction_value,enterprise_value,currency,stake_percent,payment_form,advisors,revenue_ltm,ebitda_ltm,financials_as_of,financials_currency,ev_revenue,ev_ebitda,instrument,rationale,score,evidence_label,matched_coverage,source_name,source_url,headline,first_seen_at,last_seen_at,notes
DL-1363a495ec14164a,2026-04-03,DCM,Reported,Ozon,Not applicable,Not classified,Russia,15000000000.0,,RUB,,Not applicable,Not disclosed,,,Not disclosed,Not disclosed,,,Bonds,Not disclosed,4,unverified,OZON,https://expert.ru,https://news.google.com/rss/articles/CBMiigFBVV95cUxNVmVRdkQ4RElHdURKbmVDQU9NbVRmZTd0Z3NiM3JzMjFhZzNzQzVPMnhzNHFER2VsYVAyWEpwVlg4c24zZUozY1ZNUFQxNDMxakR1Q1J0RFhhbkRxbUZYTmgtc3N3UzhsckljT1lpZTFvaXJKeGlTblNyNlNWb2JhOWFSVXZJWjZ0Rmc?oc=5,Ozon анонсировал размещение облигаций на 15 млрд рублей - https://expert.ru,2026-06-28T04:28:06+00:00,2026-06-28T05:16:57+00:00,Screening record; verify against primary transaction documents.
DL-12855c6275c496fe,2026-04-03,DCM,Announced,Ozon,Not applicable,Not classified,Not disclosed,,,NOT DISCLOSED,,Not applicable,Not disclosed,,,Not disclosed,Not disclosed,,,Bonds,Not disclosed,4,unverified,OZON,БКС Экспресс,https://news.google.com/rss/articles/CBMipgFBVV95cUxNTmtrN3N0YVN0c0NuVnBscUJvbzdVbWZ5OXczRTkySkx1T1hKdWJvZlFWNEFqbkxhRmpXVEVQZUdIcjdOZkNFRnJhX1huRGRmelhla1RRTURfejMzd2FIMU9ZcmQ4REtOWWEyZ3JhLUgwSmI2UDhJM2s4TkNRekY0T3ZtcEJNbUYzNTQzOXRITGxsN1A0N1duQ3FKeE5fTXIxMUVJTlh3?oc=5,Озон планирует дебютное размещение биржевых облигаций - БКС Экспресс,2026-06-28T04:28:06+00:00,2026-06-28T05:16:57+00:00,Screening record; verify against primary transaction documents.
DL-d39c99c4c2dfa45c,2026-03-30,DCM,Reported,VK,Not applicable,Not classified,Russia,10000000000.0,,RUB,,Not applicable,Not disclosed,,,Not disclosed,Not disclosed,,,Bonds,Not disclosed,4,unverified,VKCO,vk.company,https://news.google.com/rss/articles/CBMiUkFVX3lxTE1WcXUxeUFkWFdQQUk3U0o0RDBfeTdxa3IxV0dWLXRZZXRjWWo1M0NBOUJfeVUwNHRuMUxaOVBKVXdjSWstd1paRHFfX2lpT1VpV0E?oc=5,VK объявляет о планах по размещению биржевых облигаций объемом 10 млрд рублей - vk.company,2026-06-28T04:28:06+00:00,2026-06-28T05:16:57+00:00,Screening record; verify against primary transaction documents.
DL-b9babb23f2c4462c,2026-03-30,DCM,Reported,VK,Not applicable,Not classified,Not disclosed,,,NOT DISCLOSED,,Not applicable,Not disclosed,,,Not disclosed,Not disclosed,,,Bonds,Not disclosed,4,unverified,VKCO,Финам,https://www.finam.ru/publications/item/vk-razmeshchaet-obligatsii-kak-eto-otrazitsya-na-investorakh-v-aktsii-20260330-1740/,VK размещает облигации: как это отразится на инвесторах в акции 30.03.2026 - Финам,2026-06-28T04:28:06+00:00,2026-06-28T04:28:06+00:00,Screening record; verify against primary transaction documents.
DL-238a83afad61e805,2026-02-27,DCM,Issued,SELECTEL,Not applicable,Not classified,Russia,7000000000.0,,RUB,15.0,Not applicable,Not disclosed,,,Not disclosed,Not disclosed,,,Bonds,Not disclosed,5,confirmed,,Selectel Newsroom,https://selectel.ru/about/newsroom/news/selectel-razmestil-novyj-vypusk-obligaczij-i-privlek-7-milliardov-rublej-na-razvitie-biznesa/,"Selectel разместил новый выпуск облигаций и привлек 7 миллиардов рублей на развитие бизнеса Selectel сообщил об успешном закрытии книги заявок в рамках размещения выпуска облигаций серии 001P-07R по ставке купона 15,00% годовых сроком на три года. В ходе формирования книги заявок общий спрос инвесторов превысил первоначальный ориентир по объему выпуска, что позволило увеличить объем выпуска с 5 до 7 млрд рублей и снизить итоговую ставку купона до 15,00% годовых.",2026-06-28T05:10:25+00:00,2026-06-28T05:16:57+00:00,Screening record; verify against primary transaction documents.
DL-251bf0d0b7b600c1,2024-12-16,M&A,Reported,Not disclosed,SELECTEL,Technology,Not disclosed,,,NOT DISCLOSED,100.0,Not disclosed,Not disclosed,,,Not disclosed,Not disclosed,,,Acquisition / disposal,Not disclosed,7,confirmed,,Selectel Newsroom,https://selectel.ru/about/newsroom/news/selectel-soobshchaet-o-priobretenii-oblachnogo-provajdera-servers-ru/,"Selectel сообщает о приобретении облачного провайдера Servers.ru Selectel сообщает о приобретении 100% компании ООО «Единая сеть», работающей под брендами Servers.ru, Exepto.ru и Fozzy.ru. Сделка позволит ускорить рост бизнеса и усилить лидерские позиции Selectel на рынке облачных инфраструктурных сервисов.",2026-06-28T05:10:25+00:00,2026-06-28T05:16:57+00:00,Screening record; verify against primary transaction documents.
DL-aa5a93661389a659,2024-11-15,DCM,Announced,SELECTEL,Not applicable,Financials,Russia,3000000000.0,,RUB,,Not applicable,Not disclosed,,,Not disclosed,Not disclosed,,,Bonds,целей финансирования инвестиционной программы,5,confirmed,,Selectel Newsroom,https://selectel.ru/about/newsroom/news/selectel-planiruet-razmeshhenie-obligaczij-obemom-3-milliarda-rublej-2/,"Selectel планирует размещение облигаций объемом 3 миллиарда рублей Компания Selectel планирует разместить новый выпуск облигаций объемом 3 млрд рублей для целей финансирования инвестиционной программы. Тип купона — переменный и определяется исходя из ключевой ставки Банка России плюс премия не выше 400 базисных пунктов. Срок обращения — 2,5 года с ежемесячной выплатой купона. Сбор заявок планируется провести в конце ноября.",2026-06-28T05:10:25+00:00,2026-06-28T05:16:57+00:00,Screening record; verify against primary transaction documents.
DL-c898acc93d60813b,2024-04-09,DCM,Reported,SELECTEL,Not applicable,Not classified,Russia,4000000000.0,,RUB,15.0,Not applicable,Not disclosed,,,Not disclosed,Not disclosed,,,Bonds,Not disclosed,5,confirmed,,Selectel Newsroom,https://selectel.ru/about/newsroom/news/selectel-na-fone-povyshennogo-sprosa-na-obligaczii-chetvertogo-vypuska-uvelichil-obem-razmeshheniya-do-4-mlrd-rublej/,"Selectel на фоне повышенного спроса на облигации четвертого выпуска увеличил объем размещения до 4 млрд рублей Компания Selectel сообщила об успешном закрытии книги заявок в рамках размещения четвертого выпуска облигаций. Объем выпуска составил 4 млрд рублей, ставка купона установлена на уровне 15% годовых с ежемесячной выплатой, срок обращения 2 года.",2026-06-28T05:10:25+00:00,2026-06-28T05:16:57+00:00,Screening record; verify against primary transaction documents.
DL-3b4a4419ab6b81bf,2024-03-06,DCM,Announced,SELECTEL,Not applicable,Not classified,Russia,3000000000.0,,RUB,,Not applicable,Not disclosed,,,Not disclosed,Not disclosed,,,Bonds,Not disclosed,5,confirmed,,Selectel Newsroom,https://selectel.ru/about/newsroom/news/selectel-planiruet-razmeshhenie-obligaczij-obemom-3-milliarda-rublej/,Selectel планирует размещение облигаций объемом 3 миллиарда рублей Selectel планирует разместить выпуск облигаций объемом 3 млрд рублей с фиксированной ставкой купона и сроком обращения 2 года. Ориентир доходности — премия не выше 275 базисных пунктов к значению кривой бескупонной доходности (КБД) Московской биржи на сроке 2 года. Купонные выплаты будут осуществляться ежемесячно. Сбор заявок планируется провести в первой декаде апреля.,2026-06-28T05:10:25+00:00,2026-06-28T05:16:57+00:00,Screening record; verify against primary transaction documents.
DL-0242cf80b3f97c9c,2023-12-28,M&A,Reported,"25% провайдера IT-инфраструктуры Selectel Инвестиционный фонд Tier 5, основанный Геворком Вермишяном",Инвестиционный фонд Tier 5,Not classified,Russia,,,NOT DISCLOSED,25.0,Not disclosed,Not disclosed,,,Not disclosed,Not disclosed,,,Acquisition / disposal,Not disclosed,5,confirmed,,Selectel Newsroom,https://selectel.ru/about/newsroom/news/investicionnyj-fond-tier-5-priobrel-25-provajdera-it-infrastruktury-selectel/,"Инвестиционный фонд Tier 5 приобрел 25% провайдера IT-инфраструктуры Selectel Инвестиционный фонд Tier 5, основанный Геворком Вермишяном, ранее возглавлявшим «МегаФон», приобрел 25% провайдера IT-инфраструктуры Selectel, который входит в топ-3 российских IaaS-компаний по выручке. Детали сделки стороны не раскрывают.",2026-06-28T05:10:25+00:00,2026-06-28T05:16:57+00:00,Screening record; verify against primary transaction documents.
